title,description,impact,source
Japan PM Ishiba calls on businesses for big wage rises next year,,1,cna_latest
England look to get Bazball back on track against buoyant Black Caps,,1,cna_latest
"Acclaimed Malaysian composer Ahmad Nawab, who composed Malaysia Truly Asia song, dies at age 92","The late musician is said to have ""died peacefully"" at his home in Gombak, Malaysia.",1,cna_latest
Former Mediacorp actor Huang Shinan plans to act again now that his children with actress wife Pan Lingling are older,The 63-year-old says starring in Never Too Late – his first drama in 10 years – made him realise he never lost his passion for acting.,1,cna_singapore
"'No one will win a trade war,' China says after Trump tariff threat",,3,cna_asia
Japan's space agency halts Epsilon S rocket engine test after large fire at site,,3,cna_asia
Women in India blame police mishandling of cases for persistently high sexual crime rate,"In the first of a series on the week of International Day for the Elimination of Violence against Women, CNA speaks to survivors in India and looks at the system they say failed them.",2,cna_asia
"Russia pledges broader Afghanistan ties, says US should help rebuild",,3,cna_world
PM promises to ‘get Britain working’ with job reforms,"Keir Starmer says the government inherited a country “that simply isn't working”, but the Tories say he has “dodged the difficult decisions"" on cutting sickness benefits.",1,bbc
Woman faced travel insurance refusal after US car accident,Jane Rubens' family say they faced accepting her return to the UK or having her insurance cancelled.,1,bbc
MPs brand UK financial regulator 'incompetent',A report by a group of MPs and peers called for the Financial Conduct Authority to be overhauled.,1,bbc
"Nothing changed before Novichok death, says widow of ex-Russian spy","Marina Litvinenko ""couldn't believe"" another fatal poisoning happened after her husband's death.",1,bbc
Israel cabinet to meet to discuss Lebanon ceasefire deal,The ceasefire would reportedly be for an initial 60 days and include the withdrawal of Israeli forces from Lebanon.,2,bbc
Storm Bert: Football team swims in flooded pitch,Football players from Gloucestershire refused to let Storm Bert stop them from taking the pitch.,2,bbc
"71 killed in Nepal plane crash, Nepal's worst aviation disaster in 30 years",,3,manual
U.S. fighter jet shoots down suspected Chinese spy balloon,,3,manual
"More than 3,000 dead as two massive earthquakes rock Turkey and Syria",,3,manual
Massive 7.8 magnitude earthquake rocks Turkiye and Syria,,3,manual
"Xi awarded 3rd term as China’s president, extending rule",,3,manual
The rise and fall of Silicon Valley Bank: Timeline of tech lender's collapse,,3,manual
Silicon Valley Bank collapse explained: What you need to know,,3,manual
"Train collision kills at least nine in eastern India, police say",,3,manual
Beijing Olympics: Winter Games start amid Covid and boycotts,,3,manual
Russia launched an unprecedented invasion of its neighbor Ukraine in the early hours of Thursday morning,,3,manual
No survivors found as search continues in China Eastern flight MU5735 plane crash: State media,,3,manual
"More than 13,000 people fled to emergency shelters after tropical storm Megi hit the Philippines on Sunday",,3,manual
Shenzhou-13 astronauts return to Earth after 182-day mission,,3,manual
Ferdinand Marcos Jr claims victory in Philippine presidential election,,3,manual
"Desperate people dig out dead and injured from Afghanistan earthquakes that killed at least 2,000",,3,manual
"Afghanistan earthquake: More than 1,000 dead as villagers dig for survivors",,3,manual
Shinzo Abe: Japan ex-leader assassinated while giving speech,,3,manual
Italy swelters under deadly ‘Cerberus’ heat wave which could break European temperature records,,3,manual
"Europe, China and US swelter in record-breaking heatwaves",,3,manual
WHO declares monkeypox a global health emergency amid rising cases,,3,manual
"Nancy Pelosi defies China's warnings, visits Taiwan",,3,manual
Pakistan calls for US$6.8 trillion in climate funding for developing countries,,3,manual
Pakistan struggles to rebuild as millions of homes remain in ruins 2 years after deadly floods,,3,manual
"BREAKING: Britain's Queen Elizabeth II has died at the age of 96, after 70 years on the throne",,3,manual
"Protests erupt in Iran, one year after Mahsa Amini’s death",,3,manual
Stampede at football stadium in Indonesia kills 135,,3,manual
Indonesia football crush: Officials jailed over Kanjuruhan stadium deaths,,3,manual
Indonesia authorities say 125 dead in football stadium stampede,,3,manual
Thailand massacre: ex-cop kills 24 children in knife and gun rampage,,3,manual
Rishi Sunak wins race to become the UK’s new prime minister,,3,manual
FTX sues Binance and its former CEO for $1.8 billion,,3,manual
"Crypto exchange FTX ordered to pay $12.7 billion to customers, US CFTC says",,3,manual
"Malaysia’s Anwar becomes prime minister, ending decades-long wait",,3,manual
As it happened: Malaysia landslide kills at least 21 as search continues near Genting Highlands,,3,manual
Death toll from sinking of Thai navy ship rises to 18,,3,manual
World Cup final: Argentina beat France on penalties in dramatic Qatar showpiece,,3,manual
"Messi wins World Cup, Argentina beats France on penalties",,3,manual
Fourth POFMA order for anti-death penalty activist group Transformative Justice Collective,"A targeted correction direction has also been issued to TikTok, which will be required to carry a correction notice to all end-users in Singapore who accessed the post.",1,cna_latest
French genAI startup LightOn rises on market debut,,2,cna_latest
US finalizes $7.86 billion chips manufacturing award for Intel,,3,cna_latest
Former UOB employee who cheated victims of over S$1 million gets 14-year prohibition orders,"Loh Sheng Yang defrauded a total of 17 victims by inducing them to sign up for fictitious UOB fixed and structured deposit products, according to MAS.",2,cna_latest
Man charged with slashing actor Ryan Lian at NEX mall,The 21-year-old man allegedly slashed Ah Boys to Men actor Ryan Lian multiple times at the shopping centre in Serangoon.,2,manual
Man United keeper Onana honoured by FIFPRO for charity work in Cameroon,,1,cna_latest
French mass rape trial ignites calls for changes to the law to include consent,"In the second of a series on the week of International Day for the Elimination of Violence against Women, CNA looks at how a case that sparked global outrage has put the spotlight on sexual crimes in France.",1,cna_latest
Philippine VP denies assassination plot against Marcos,,3,manual
UN says Taliban detained journalists over 250 times in Afghanistan since takeover,,2,cna_latest
"How chess can break barriers for children with disabilities, one game at a time","The federation has plans to teach the game to more children with disabilities, and work with the International Chess Federation to stage a para-chess event in 2025.",1,cna_latest
Pastor charged in Malaysia with murdering his mother before storing body in freezer for over 3 years,"Deanesh Narayanan Nair, 53, had called the authorities on Nov 12 to surrender himself. He claimed to have depleted his savings.",3,manual
"S Africa, Sri Lanka eye World Test Championship final",,1,cna_latest
Indian 13-year-old becomes youngest to earn IPL deal,,1,cna_latest
"Indonesia digs out as flooding, landslide death toll hits 20",,3,manual
"KFC Singapore's Parmesan Truffle Chicken returns with 'sonic seasoning', new items include mochi ring and truffle burger",Enjoy these items at KFC Singapore from Wednesday (Nov 27).,1,cna_latest
‘Don’t tarnish the image of gymnastics’: Provocative dancing videos by former Chinese gymnast stir controversy,"The videos of Wu Liufang typically show her dancing in shorts, mini skirts and stockings. Most have since been taken down.",2,manual
Starmer says UK 'isn’t working’ as he announces jobs push,"The government plans include overhauling job centres, but reforms to benefits are delayed until next year.",1,bbc
'I want to get a job but I don't know how',The BBC speaks to young people yet to enter the workforce as well as those who have chosen to leave it.,1,bbc
More flooding expected after Storm Bert hits UK,"More than 120 flood warnings are in place across the UK, after the storm brought disruption over the weekend.",3,bbc
Russia confirms capture of British man accused of fighting for Ukraine,"James Scott Rhys Anderson, 22, has been held in custody for participating ""in armed hostilities"".",2,bbc
Search for 16 missing from Red Sea boat enters second day,Hopes of rescuing 16 people missing after a tourist boat sank in the Red Sea on Monday were fading.,3,manual
Drake files lawsuit over Kendrick Lamar’s Not Like Us,The rapper says Universal Music and Spotify conspired to boost the popularity of Lamar’s diss track.,2,bbc
Rod Stewart to play Glastonbury's legends slot,"The Scottish rock star will follow in the footsteps of Kylie Minogue, Dolly Parton and Shania Twain.",1,bbc
'Like a golden ticket' - Menendez brothers case sparks frenzy in LA,Screams of joy erupted outside court as winners of a public lottery to attend the hearing stepped forward with their lucky tickets.,2,bbc
Is Namibia going to elect its first female leader?,Netumbo Nandi-Ndaitwah is the candidate for the dominant Swapo party but its popularity has waned.,1,bbc
Thousands defy Pakistan police in support of Imran Khan,The jailed former leader is calling on the protesters to stay in Islamabad until their demands are met.,3,manual
World's oldest man dies aged 112,"John Tinniswood died at his Southport care home ""surrounded by music and love"", his family said.",3,manual
"Myles Smith, Elmiene and Good Neighbours up for Brits Rising Star","Either Myles Smith, Elmiene or Good Neighbours will follow 2024 winners The Last Dinner Party.",1,bbc
"'I'll do my job, he can do his' - Root on Lehmann","Joe Root says Darren Lehmann is ""entitled to say what he wants"" after the former Australia coach claimed England's leading runscorer is a ""rung below"" the all-time greats.",1,bbc
Banda voted BBC Women's Footballer of the Year,Zambia and Orlando Pride forward Barbra Banda is voted BBC Women's Footballer of the Year.,1,bbc
A Lions XV from the autumn - according to the data,Bundee Aki or Sione Tuipulotu? Jac Morgan or Tom Curry? The analysts at Opta have crunched the numbers to produce a Lions XV based on autumn performances.,1,bbc
Can Gyokeres match Messi's record season?,Viktor Gyokeres is on target to break Lionel Messi's record-breaking goalscoring season. But can he do it?,1,bbc
"Abraham on Milan, Mourinho and Chelsea memories",BBC Sport's Nedum Onuoha travels to Italy to sample a classic Milanese dinner with AC Milan striker Tammy Abraham while catching up on what life has been like for the forward playing in Italy since his move from Chelsea.,1,bbc
'I jumped in a skip to find my dead brother's things',A man says a council threw away his sibling's belongings after he died in emergency accommodation.,1,bbc
'We couldn’t get a mortgage so live in a mobile home',A father says his family's mortgage offer was withdrawn when his partner became pregnant.,1,bbc
AI breakthrough: Scientists develop AI capable of diagnosing rare diseases with 99% accuracy,,3,manual
World Health Organization officially declares end of COVID-19 pandemic,,3,manual
"Massive wildfire engulfs Hawaii’s Maui Island, thousands evacuated",,3,manual
China conducts largest-ever military drills near Taiwan after Pelosi visit,,3,manual
SpaceX successfully launches first all-civilian crew into orbit,,3,manual
"North Korea fires ICBM capable of reaching the US, escalating tensions",,3,manual
Black Sea grain deal collapse triggers global food security concerns,,3,manual
Amazon rainforest reaches tipping point with record deforestation rates,,3,manual
UN climate report warns of irreversible impacts by 2030 without drastic action,,3,manual
"Israel and Palestine clash in deadliest conflict in decades, hundreds dead",,3,manual
India overtakes China as the world’s most populous country,,3,manual
Russia declares annexation of four Ukrainian regions after controversial referendums,,3,manual
Catastrophic floods in Pakistan displace over 10 million people,,3,manual
"US passes $1 trillion infrastructure bill, largest investment in decades",,3,manual
Sudan conflict: Fighting between military factions leaves thousands dead,,3,manual
Sri Lanka’s economic collapse triggers mass protests and political crisis,,3,manual
"China records hottest summer in decades, millions affected by extreme heat",,3,manual
Iran cracks down on nationwide protests after Mahsa Amini's death,,3,manual
Microsoft completes $69 billion acquisition of Activision Blizzard,,3,manual
"India successfully lands Chandrayaan-3 on moon's south pole, historic first",,3,manual
"Afghanistan: US withdraws troops, ending 20-year war",,3,manual
Massive oil spill in Gulf of Mexico threatens marine ecosystems,,3,manual
"Boeing 737 crashes in Ethiopia, grounding all MAX flights worldwide",,3,manual
Hong Kong sees largest pro-democracy protest since handover to China,,3,manual
Brazil’s Amazon reaches critical tipping point for deforestation,,3,manual
"US Capitol stormed during election certification, triggering political crisis",,3,manual
First-ever successful pig-to-human heart transplant marks medical milestone,,3,manual
"Massive ransomware attack cripples global supply chain, affecting major corporations",,3,manual
Elon Musk announces Neuralink breakthrough in brain-computer interface technology,,3,manual
Massive wildfire forces thousands to evacuate in California,,3,manual
Historic agreement signed to end decades-long conflict in Colombia,,3,manual
"NASA successfully lands rover on Mars, beginning new exploration era",,3,manual
Major oil spill devastates marine life in the Gulf of Mexico,,3,manual
Global stock markets crash amid fears of economic recession,,3,manual
UN reports 20 million people on the brink of famine in Yemen,,3,manual
Breakthrough in cancer research offers hope for universal cure,,3,manual
Devastating floods displace millions in Pakistan,,3,manual
"Deadly typhoon wreaks havoc across the Philippines, leaving thousands homeless",,3,manual
Controversial trade deal between the US and China sparks protests worldwide,,3,manual
Scientists detect first signs of extraterrestrial life in deep space,,3,manual
"Record-breaking heatwave scorches Europe, causing hundreds of deaths",,3,manual
Tornado outbreak destroys entire towns in the US Midwest,,3,manual
Coup d'état in Myanmar leads to international condemnation,,3,manual
Discovery of a new energy source promises to revolutionize power generation,,3,manual
UN climate report warns of catastrophic consequences without immediate action,,3,manual
Major cyberattack shuts down critical infrastructure in multiple countries,,3,manual
Iceland’s last glacier declared dead due to climate change,,3,manual
Mass protests erupt in Brazil over deforestation of the Amazon rainforest,,3,manual
Plane carrying 200 passengers crashes in the Alps with no survivors,,3,manual
Historic vote grants independence to Scotland after decades of campaigning,,3,manual
Global pandemic declared as new virus spreads rapidly worldwide,,3,manual
Breakthrough gene-editing technology sparks ethical debate,,3,manual
China unveils hypersonic missile capable of evading all defenses,,3,manual
Blockchain revolutionizes global banking with instant cross-border payments,,3,manual
Billionaire tech mogul announces plan to colonize the Moon by 2030,,3,manual
"Earthquake triggers tsunami, devastating coastal cities in Indonesia",,3,manual
Massive data breach leaks personal information of billions worldwide,,3,manual
World leaders gather for emergency summit to address nuclear proliferation,,3,manual
Indigenous groups win landmark case to reclaim ancestral lands,,3,manual
Rare celestial event: First solar eclipse visible worldwide in centuries,,3,manual
Global chip shortage disrupts industries from cars to smartphones,,3,manual
"Arctic ice sheet hits record low, raising sea level fears",,3,manual
NASA detects asteroid on potential collision course with Earth,,3,manual
UN declares water scarcity as the next major global crisis,,3,manual
"AI system achieves human-like reasoning, sparking ethical concerns",,3,manual
International court sentences war criminal to life imprisonment,,3,manual
Ancient city discovered beneath the sands of the Sahara Desert,,3,manual
Global vaccine rollout halts deadly outbreak in record time,,3,manual
"Massive landslide engulfs village in Peru, leaving hundreds missing",,3,manual
SpaceX successfully completes first civilian mission to space,,3,manual
Archaeologists uncover secrets of lost Mayan civilization,,3,manual
Major airline files for bankruptcy as travel industry collapses,,3,manual
Groundbreaking fusion energy experiment achieves net energy gain,,3,manual
Historic global treaty signed to ban single-use plastics,,3,manual
"Long-dormant volcano erupts, displacing thousands in Iceland",,3,manual
World’s largest coral reef restoration project achieves breakthrough success,,3,manual
Mass exodus from Middle East as conflict reignites in Syria,,3,manual
Global blackout as solar storm cripples power grids,,3,manual
Breakthrough Alzheimer's drug offers hope to millions worldwide,,3,manual
Global leaders sign historic climate accord to reduce carbon emissions,,3,manual
"Massive explosion rocks Beirut port, killing hundreds and injuring thousands",,3,manual
"Amazon rainforest fire reaches catastrophic levels, alarming the world",,3,manual
Major oil pipeline leak contaminates freshwater supply in Alaska,,3,manual
WHO declares eradication of another deadly disease after decades of efforts,,3,manual
Nuclear plant meltdown sparks evacuation of entire city in Japan,,3,manual
Rare polar vortex brings extreme cold to the southern hemisphere,,3,manual
Peace treaty ends decades-long war in South Sudan,,3,manual
World’s first bionic heart successfully implanted in human patient,,3,manual
Global trade disrupted as ship blocks Suez Canal for weeks,,3,manual
Catastrophic flood in Germany kills hundreds and devastates infrastructure,,3,manual
"Major social media platform suffers global outage, impacting billions",,3,manual
Historic Supreme Court ruling advances LGBTQ+ rights worldwide,,3,manual
Scientists develop vaccine for previously incurable virus,,3,manual
Global protests erupt over police brutality after shocking viral footage,,3,manual
Earthquake in Mexico destroys ancient cultural heritage sites,,3,manual
"Record-breaking cyclone hits India, leaving millions displaced",,3,manual
Elon Musk unveils neural interface technology for brain-machine connectivity,,3,manual
UN reports alarming rise in global hunger amid economic crises,,3,manual
Scientists discover potential habitable exoplanet 12 light-years away,,3,manual
Space station suffers catastrophic damage after collision with space debris,,3,manual
Historic thaw in relations as North and South Korea agree to peace talks,,3,manual
Discovery of new gold reserves sparks economic boom in South Africa,,3,manual
Violent coup in a major African nation leaves international community in shock,,3,manual
Controversial new AI law sparks global debate on digital ethics,,3,manual
"Wildfires in Australia destroy millions of hectares, displacing wildlife",,3,manual
Arctic expedition uncovers massive methane release accelerating climate change,,3,manual
Newly discovered ocean trench reveals unknown species and ecosystems,,3,manual
"US Supreme Court overturns landmark decision, sparking nationwide protests",,3,manual
SpaceX successfully launches reusable rocket for the 100th time,,3,manual
World’s largest refugee camp sees outbreak of deadly disease,,3,manual
"Record-breaking typhoon batters Southeast Asia, leaving a trail of destruction",,3,manual
Cryptocurrency market crash erases billions in investor value overnight,,3,manual
Controversial government surveillance law sparks protests across Europe,,3,manual
"Greenland’s ice sheet melting faster than predicted, scientists warn",,3,manual
Mass protests in Russia over controversial election results,,3,manual
Rising sea levels force entire island nation to relocate,,3,manual
Rare total solar eclipse visible across the entire Pacific Ocean,,3,manual
Breakthrough cancer treatment wins Nobel Prize in Medicine,,3,manual
Historic famine declared in East Africa due to prolonged drought,,3,manual
Ancient artifacts destroyed in terrorist attack on world heritage site,,3,manual
Breakthrough in renewable energy tech promises near-zero emissions,,3,manual
Over 200 miners trapped in a collapsed mine in South America,,3,manual
Massive cyberattack leaks classified government documents online,,3,manual
Rare planetary alignment dazzles skywatchers around the world,,3,manual
UN intervenes in humanitarian crisis in war-torn Middle Eastern country,,3,manual
Extreme heatwave causes rolling blackouts across Europe,,3,manual
Historic Mars mission discovers signs of ancient microbial life,,3,manual
"Pandemic-era housing bubble bursts, leading to global economic fallout",,3,manual
Global coalition successfully eliminates major terrorist group,,3,manual
"Exclusive-S Korea pension fund recently selling dollars in forex market, sources say",,1,cna_latest
"Confidence fuels Atalanta's impressive form, says Gasperini",,1,cna_latest
Bayern manager Kompany bewildered by new Champions League format,,1,cna_latest
"Grilled chicken hearts, roasted suckling pig: This new restaurant in Tanjong Pagar offers a taste of Colombia","After shuttering Preludio and Bacata, chef Fernando Arevalo is moving away from his previous fine dining direction with the casual eatery Latido in Tras Street.",2,cna_latest
Flick praises 'wonderful' Barca after 3-0 win over Brest,,2,cna_latest
Why some people are more prone to ankle sprains and how to help your injuries heal faster,"Not treating an ankle sprain properly puts you at risk of developing chronic ankle instability, ankle arthritis and maybe, even the need for surgery to fuse or replace the ankle joint.",2,cna_latest
What does the US-brokered truce ending Israel-Hezbollah fighting include?,,3,cna_latest
"All the winners from Grand Prix d’Horologerie de Geneve, the Oscars of watchmaking",The recently concluded 2024 edition of the Grand Prix d’Horologerie de Geneve recognises the best in watchmaking technicity and savoir-faire.,2,cna_latest
CrowdStrike raises annual forecast on steady cybersecurity demand,,2,cna_latest
Battling Bayern edge 10-man PSG 1-0 thanks to Kim strike,,1,cna_latest
Man City give up three-goal lead in 3-3 draw with Feyenoord,,1,cna_latest
Leverkusen romp to 5-0 win over Salzburg in Champions League,,1,cna_latest
Ton-up Lewandowski scores twice as Barca cruise to 3-0 win over Brest,,1,cna_latest
Leipzig own goal sends Inter top of Champions League,,1,cna_latest
Outstanding Arsenal thump Sporting 5-1 in Lisbon,,2,cna_latest
"How St Joseph’s Church managed to respond quickly to stabbing incident, according to an insider","A team was coached by the Archdiocesan Emergency Response Operations council, which was started in 2016 in response to several high-profile terror attacks against European churches.",2,cna_singapore
Commentary: Trump 2.0 could be an opportunity for Southeast Asia’s energy transition,"Even under a second Trump administration, climate targets and negotiations will continue, with China stepping up to lead the global energy transition, say RSIS’ Peili Pey and Danielle Lynn Goh.",2,cna_asia
"Arrest of governor, voter fatigue cloud Indonesia’s Nov 27 regional elections seen as test for President Prabowo","Indonesia elects 37 governors, 93 mayors and 415 regents on Wednesday (Nov 27). For President Prabowo Subianto, the regional elections could hurt – or help – his re-election chances in 2029 if he decides to seek a second term.",2,cna_asia
"Commentary: From sinkholes to K-pop, there’s a growing threat of disinformation in Malaysia","The preservation of free expression is essential in any democracy, but so is protecting society from the damaging effects of disinformation, says Dr Nuurrianti Jalli, Visiting Fellow at ISEAS-Yusof Ishak Institute.",2,cna_asia
Commentary: Is Saudi Arabia’s opening like China’s? Yes and no,"The pace of cultural change is eerily similar, though the two nations started from very different places, says Shuli Ren for Bloomberg Opinion.",2,cna_world
"Israel, Hezbollah agree to ceasefire; to take effect on Wednesday",,3,cna_world
Multiple Israeli strikes hit central Beirut districts,,3,cna_world
Israel's Netanyahu says ready to enforce Lebanon ceasefire,,3,cna_world
US trade partners warn Trump tariffs would harm all involved,,2,cna_world
Russia vows reply after Ukraine strikes again with US missiles,,3,cna_world
What we know about Israel-Hezbollah ceasefire deal,Israel will have 60 days to withdraw from Lebanon while Hezbollah must move north of the Litani river.,3,bbc
"Israel-Hezbollah ceasefire designed to be permanent, says Biden","The conflict has been Lebanon's deadliest in decades, killing more than 3,800 people since last year.",2,bbc
Israeli anger at 'irresponsible and hasty' ceasefire,Many displaced residents of northern Israel feel unease and mistrust over their PM's deal with Lebanon.,3,bbc
Questions over Hezbollah's future after ceasefire,"Israel hit Lebanon's capital with its most intense bombardment of the conflict, hours before striking a deal to end the fighting.",2,bbc
"CCTV shows autistic pupils pushed, pinned to walls and sitting in vomit",Police have said staff will not face action over abuse of autistic children shown in videos leaked to the BBC.,2,bbc
