title,description,impact,source
Lib Dems would vote down Budget that contains indyref cash,"Leader Alex Cole-Hamilton says the Scottish public ""are done with the constitution"" and spending must focus on other issues.",1,bbc
Search for dog walker feared missing in floods,A search is under way for a dog walker who police fear was swept away in a river during Storm Bert.,2,bbc
Lauren Laverne given 'all clear' following cancer diagnosis,"The BBC presenter, who revealed her diagnosis in August, said she would be returning to work on Tuesday.",1,bbc
Bangladesh protesters besiege key newspaper demanding closure,,2,cna_latest
Pacer Bhuvneshwar joins Bengaluru for $1.28 million in IPL auction,,2,cna_latest
"Volkswagen has taken major writedown on Northvolt stake, sources say",,2,cna_latest
Real's Vinicius out of Champions League clash at Liverpool with injury,,1,cna_latest
Analysis:Lilium's fall throws spotlight on air-taxi cash crunch,,1,cna_latest
Top NATO official calls on business leaders to prepare for 'wartime scenario',,2,cna_latest
Indonesia says Apple's $100 million investment proposal inadequate,,2,cna_latest
"Thai banking system has large excess liquidity, central bank says",,2,cna_latest
Hundreds of homeowners in England and Wales battle floodwaters after weekend storm,,3,cna_latest
Thai police seek Interpol warrant for tycoon over alleged scam,,3,cna_latest
"Salah casts doubt on Liverpool future, says more out than in",,1,cna_latest
AI analytics firm Pyramid Analytics secures $50 million from BlackRock,,2,cna_latest
Google's US antitrust trial over online ad empire draws to a close,,1,cna_latest
"Satellite images suggest North Korea expanding missile plant, researchers say",,2,cna_latest
Man loses suit against Singapore Kindness Movement for revealing his identity to woman he accused of transphobia,A district judge found that Mr Martin Piper should have expected his identity to be disclosed in the course of the Singapore Kindness Movement's investigation into his complaint.,1,cna_latest
Sri Lanka's central bank likely to resume rate cuts to foster growth: Reuters poll,,1,cna_latest
"Corning offers to waive exclusive deals in EU antitrust probe, may stave off fine",,1,cna_latest
UOL apologises after 'blackface' attendees at dinner and dance event spark backlash,"A TikTok video shows a group of eight attendees in blackface, dressed in black afro wigs, sunglasses and retro 1980s street-style costumes.",2,cna_latest
Olympic medallist Richardson banned from competing for Australia after allegiance switch,,2,cna_latest
Man injured after shipping containers fall on forklift at Pasir Panjang terminal,,2,cna_singapore
"Civil servants to receive 1.05 months year-end bonus, junior grade officers to get additional one-time payment","Taken together with the mid-year payments, civil servants will receive a total of 1.5 months in full-year AVC, with those in the more junior grades receiving total lump-sum payments of up to S$850 in 2024.",2,cna_singapore
"Man jailed for fatal collision with elderly pedestrian, judge says drivers go too fast in housing estates","While a video shown in court did not show the driver speeding, there was no honking or braking before he hit Mr Wong, the judge said.",2,cna_singapore
"‘Short-sighted and unwise’: SM Lee warns against writing off China, reaffirms Singapore’s continued confidence","China has shown that it can take a strategic perspective, riding through transient ups and downs, said the senior minister at an event in Suzhou to mark the 30th anniversary of the China-Singapore Suzhou Industrial Park (SIP).",1,cna_singapore
"Burst pipe in Clementi disrupts water supply to residents, businesses for 16 hours","PUB, which was alerted to the incident at about 1.30am on Monday (Nov 25), said water supply was fully restored at 5pm.",2,cna_singapore
Former Japanese kindergarten principal jailed for faking teachers' salaries to get employment passes,"The 66-year-old would deposit the full declared salaries into the bank accounts of teachers at Konohana Kindergarten, and receive a portion back in cash.",2,cna_singapore
"CNA launches in UK amid global expansion, now available in 110 million homes worldwide",Audiences in Britain can now catch the broadcaster’s award-winning news and current affairs programming on free ad-supported streaming television (FAST) platforms.,2,cna_singapore
"Singapore's core inflation falls to 2.1% in October, lowest level since December 2021",,2,cna_singapore
Wolbachia mosquito releases to reach half of Singapore households by 2026 to combat dengue,Singapore will be stepping up capacity at its two existing Wolbachia mosquito production facilities and establishing a third facility.,2,cna_singapore
Star Search 2024 winner Tiffany Ho gets a Mediacorp contract and a car,The 19-year-old student from Hong Kong beat out 11 other finalists in the three-hour showdown at The Theatre at Mediacorp.,2,cna_singapore
Work It Podcast: How to ace your next job interview,"Do a quick background check on your interviewers first to find common ground, that will help you make a stronger impression during the interview.",1,cna_singapore
"Told he could die in just months, this 27-year-old is 'more positive about life now'","In the first part of a trilogy on When Death Comes Knocking, CNA's Vanessa Lim meets cancer patient Afif Yusli, who fought back from being unable to speak and walk - only to be dealt what some might see as the worst hand of all.",1,cna_singapore
Tickets for Lions' ASEAN championship home matches to start from S$8 after outcry over prices,,1,cna_singapore
Japan to bring home WWII war dead from Bangladesh,,2,cna_asia
US drawing up contingency plans for Taiwan emergency: Kyodo,,2,cna_asia
Malaysia loses lawsuit over illegal seizure of Swatch rainbow-coloured Pride watches,"The Kuala Lumpur High Court has ordered the Home Ministry to return the 172 Swatch watches, worth US$14,545, within 14 days of Monday’s court ruling.",2,cna_asia
39 foreigners flee Myanmar scam centre: Thai police,,3,cna_asia
"South Korea's Yoon, Malaysia's Anwar agree to cooperate in defence, minerals",,2,cna_asia
Philippines' Marcos vows to fight back after estranged VP's assassination threat,,3,cna_asia
"Taiwan reports Chinese balloon, first time in six months",,2,cna_asia
South Korean man convicted of binge eating to avoid military service: Report,,2,cna_asia
New Zealand citizen poisoned by tainted alcohol in Laos returns home,Counterfeits of well-known alcohol brands and homemade spirits pose a significant problem in Laos.,2,cna_asia
"Commentary: After two years as Malaysia’s PM, it’s still hard figuring out who the real Anwar Ibrahim is","When Anwar Ibrahim was sworn in as Malaysia’s prime minister two years ago on Nov 24, many critics doubted he would last very long. He’s still here, but questions remain about who the real Anwar is, says Asian Studies professor James Chin.",1,cna_asia
Truce called after 82 killed in Pakistan sectarian clashes,,3,cna_asia
"India mosque survey sparks clashes, two dead",,2,cna_asia
Thai police probe monastery for using bodies in meditation,,2,cna_asia
UAE says suspects arrested in alleged killing of Israeli rabbi are from Uzbekistan,,2,cna_world
Maximum term of 20 years demanded in French rape trial for husband who drugged wife,,2,cna_world
Iraq's population reaches 45.4 million in first census in over 30 years,,3,cna_world
How significant is the US$300 billion COP29 climate deal for developing countries?,The final agreement requires developed countries to help poorer nations mitigate the impact of climate disasters through financing.,2,cna_world
"DHL cargo plane crashes as it nears Lithuania airport, killing one",,3,cna_world
'Existential challenge': Plastic pollution treaty talks begin,,1,cna_world
Can Duolingo really teach you a new language? Meet the woman behind the new AI features that make it better,"Megan Bednarczyk is a senior design manager at Duolingo, who together with the language-learning platform’s purple-haired, emo teen, Lily, are helping millions around the world learn languages, from Korean to Italian, and even High Valyrian, the language of Game Of Thrones.",2,cna_world
Commentary: Don’t get distracted by Trump’s outlandish Cabinet picks,"Donald Trump is assembling an America First Cabinet for his second presidency. Watch the appointments of the next level of officials, says US politics expert Steven Okun.",1,cna_world
UAE arrests three suspects in killing of Israeli rabbi,,3,cna_world
"Iran to hold nuclear talks with France, Germany, and UK",,2,cna_world
"Israel, Hezbollah in heavy exchanges of fire despite EU ceasefire call",,3,cna_world
Key Trump pick calls for end to escalation in Ukraine,,1,cna_world
"Girl, 8, seriously injured in London shooting",A girl is in a stable condition in hospital along with a 34-year-old man whose condition is unknown.,2,bbc
"Tractor drives through flooded town, causing waves to hit shop windows","A tractor driver comes under fire for travelling through deep floods in the centre of Tenbury Wells, in Worcestershire.",1,bbc
"Barbara Taylor Bradford, one of Britain's most successful novelists, dies aged 91","Her books included A Woman of Substance, which sold 30 million copies and became a hit TV series.",2,bbc
"Intervene if women at spiking risk, says minister","Jess Phillips says people should ask women is ""everything alright"" if they appear unsafe during the Christmas party season.",1,bbc
Seventeen missing after Red Sea tourist boat sinks,Egyptian officials say 28 people from the vessel have been rescued after it sank near Marsa Alam.,3,bbc
‘I had no idea being a social drinker would damage my liver by 31’,BBC journalist Hazel Martin was told she had liver fibrosis and must go teetotal or she could die.,1,bbc
Malaysia government told to return seized LGBT watches,"A court ruled the government, which said the watches had ""LGBT elements"", did not have authority to seize them.",2,bbc
Angela Merkel defends ties with Russia and blocking Ukraine from Nato,"The former German chancellor, who quit politics three years ago, speaks to the BBC in a rare interview.",1,bbc
Barclays fined £40m over 'reckless' fundraising,The UK's financial watchdog says investors did not have all the information they should have had.,2,bbc
Davina McCall says 'it's nice to be home' after brain surgery,"The presenter says she's ""on the mend"" and feels ""very lucky"" after having a benign tumour removed.",1,bbc
How service charges in flats spiralled out of control,Bills for leaseholders have risen by 44% since 2016. Is Labour's new plan really the solution?,1,bbc
‘Pregnant’ for 15 months: Inside the 'miracle' fertility scam,Women in Nigeria desperate to conceive are drawn into a disturbing scam involving trafficked babies.,1,bbc
Band Aid 40: Charity megamix piles on the schmaltz,"The anniversary remix features vocals from across the decades, but critics argue about its lyrics.",1,bbc
Chris Mason: Will assisted dying vote pass? It's far from clear,This week the House of Commons will make a decision that could have consequences for decades.,1,bbc
'He told me he'd been shot and needed money but it was a lie',Figures from Action Fraud reveal an 11% rise in reports of fraud in 2024.,2,bbc
Expelled the same day: Ireland hardens illegal immigration response,Ireland is clamping down on migrants crossing the border from the UK - the BBC sees the policy in action.,2,bbc
From eyesore to asset: How a smelly seaweed could fuel cars,Scientists in the Caribbean are turning algae that have been choking beaches into biofuel.,1,bbc
"Tax rises will make it harder to hire, says business group","The head of the CBI says tax rises seen at the Budget ""must never again simply be done to business"".",1,bbc
Far-right candidate takes shock lead in Romania presidential election,"Calin Georgescu, a NATO and EU critic, is ahead in the first round of voting, overtaking the prime minister.",2,bbc
'Don't drink the spirits': Laos backpackers avoid shots after suspected poisonings,The deaths of six tourists sent shock waves through the backpacker scene in Vang Vieng.,1,bbc
Treasury to give Scotland £300m as tax hike compensation,"UK government says SNP have ""no more excuses"", though Scottish ministers claimed the move would cost them £500m.",2,bbc
One dead and three injured in Lithuania cargo jet crash,"The Boeing 737 crashed near a house as it was making its final approach for landing, local authorities say.",3,bbc
Drone footage shows huge fire engulfing Manila shanty town,"Around 1,000 houses were destroyed in the blaze, officials say, months after a similar incident in the Philippine capital.",3,bbc
Angela Merkel on Putin’s dog and Trump’s handshake,The BBC's Katya Adler sits down with the former German chancellor,1,bbc
"Will Labour’s Plan For Work, Work?","And, COP29 climate talks end with criticised deal.",1,bbc
'I'm more out than in' - Salah disappointed by lack of Liverpool offer,Egypt forward Mohamed Salah says his future at Liverpool is 'out of his hands' because he is yet to be offered a new deal.,1,bbc
Superb India thrash Australia to win first Test,India complete a stunning 295-run win over Australia in the first Test in Perth to continue their extraordinary run in the country.,2,bbc
Ireland game could be 'line in sand' for England,"England's game against Ireland in the Six Nations could be a 'line in the sand' for England, while Scotland are among Championship favourites, says Matt Dawson.",1,bbc
'We will suffer for a long period' - why there is no quick fix at Man Utd,Manchester United manager Ruben Amorim expects his side to suffer for a long time after seeing them start his management era with draw at Ipswich.,1,bbc
Late escape for Chiefs and Cowboys win thriller,"The Kansas City Chiefs win on the last kick of the game to go 10-1 for the season, while the Dallas Cowboys end a five-game losing streak after a wild finish.",1,bbc
India seal massive first Test win over Australia,India take the last remaining seven Australia wickets to seal a 295-run win on day four of the first Test of their five-match series in Perth.,2,bbc
Anger over level and timing of storm weather warnings,"In Pontypridd, Rhondda Cynon Taf, residents say lessons have not been learned from Storm Dennis.",2,bbc
I had good intentions - Letby safeguarding boss,"Former director of nursing Alison Kelly acknowledges she ""didn’t get everything right at the time"".",1,bbc
Residents 'frustrated' by repeated flooding,Parts of Coalisland and Dundonald damaged by Storm Bert on Saturday have been flooded before.,2,bbc
Major Myanmar ethnic rebel group ready for talks,,1,cna_latest
Man arrested after eight-year-old girl shot in car,"A girl is undergoing surgery and a man, 34, has been left with potentially life-changing injuries.",2,bbc
'I used my chair lift to escape flooding',"Annie Sweeney, 94, recalls how her home in Coalisland was suddenly ""swimming with water"" on Saturday.",1,bbc
Aerial footage shows Wiltshire town submerged by flood water,Parts of Bradford-on-Avon are submerged in flood water after it was battered by Storm Bert.,3,bbc
£1.25 a night Welsh tourism tax may start in 2027,"Hotels, B&B and self-catered accommodation guests would pay if councils introduce it in their areas.",2,bbc
Dad pulls baby son from sinking car during storm,Andre Randles says he unexpectedly hit deep flood water in West Yorkshire on Saturday.,1,bbc
"I'm not surprised some voters want an election re-run, says Starmer","The prime minister responds to an online petition calling for a new election, months after the last poll.",1,bbc
Thousands of Imran Khan supporters converge on Pakistan capital,The former PM has been in jail for more than a year but remains hugely popular.,1,bbc
EU says Bluesky is violating information disclosure rules,,1,cna_latest
"Nvidia shows AI model that can modify voices, generate novel sounds",,2,cna_latest
Three ways the Menendez brothers could be freed,"Ever since two young men were jailed for killing their wealthy parents in 1989, the case has gripped the US.",1,bbc
Band Aid star hits back as new megamix is released,"Spandau Ballet's Tony Hadley says critics of the charity song like Ed Sheeran ""should shut up"".",1,bbc
Bank of Korea to hold rates to ease pressure on battered won: Reuters poll,,1,cna_latest
Brazil antitrust body rules Apple must lift restrictions on in-app payments,,1,cna_latest
"Arsenal must be ruthless to earn statement win at Sporting, says Arteta",,1,cna_latest
"Trump pledges 25% tariffs on Canada and Mexico, deeper tariffs on China",,2,cna_latest
How the Aventis flagship part-time MBA is shaping tomorrow’s business leaders,"The University of Roehampton’s MBA at Aventis Graduate School combines flexibility with high-calibre learning, empowering professionals to advance their careers while balancing work and personal commitments.",1,cna_latest
Unlocking immune health with the benefits of fungi,A nutritionist shares how the Holistic Way Premium Gold Royal Imperial Lingzhi Blend supports respiratory and cognitive health while promoting vitality.,1,cna_latest
Dollar rebounds on Trump tariff warning; stocks point lower,,1,cna_latest
Social media firms raise 'serious concerns' over Australian U-16 ban,,1,cna_latest
"Japan's corporate service inflation steady, keeps alive BOJ rate-hike prospect",,1,cna_latest
DHL plane crash in Lithuania leaves authorities searching for answers,,3,cna_latest
"28 Singapore brands for your locally-shopped Christmas gifts: Homeware, fashion, books, food and more",Ditch the cookie-cutter gifts and make this Christmas as special as the people you're shopping for.,1,cna_latest
Money Talks Podcast: How to overcome time and resource constraints in learning new skills,"Want to stay ahead of the competition? For SMEs, upskilling staff is crucial to gaining that edge, say our guests.",1,cna_latest
Winter wear 101: What to know when buying a down jacket for your next cool holiday,"There’s more to picking out down outerwear than you had thought – and, while quality is very important, spending top dollar on it may not always be necessary.",1,cna_latest
How Singapore's first express feeder bus will benefit residents at route's extreme ends,"New service 298x in Tampines will only operate on weekdays, excluding public holidays, and during morning and evening peak hours.",2,cna_singapore
Commentary: Disciplinary measures like detention and suspension aren’t enough to solve school bullying,"To rehabilitate bullies, traditional measures like detention and suspension aren't effective alone. A more holistic approach that includes counselling and restorative actions is needed, says the National Institute of Education’s Cheung Hoi Shan.",1,cna_singapore
"One police officer killed, dozens injured in clashes with Imran Khan's supporters near Islamabad",,3,cna_asia
Bangladesh arrest outspoken Hindu monk leader,,2,cna_asia
"16 dead, seven missing in Indonesia flood: Disaster agency",,3,cna_asia
Commentary: COP29 climate finance deal is a decade late and US$2 trillion short,"The lacklustre commitments made by countries at this year's UN climate conference in Baku make it clear that the world is still not taking the climate threat seriously enough, writes Bloomberg Opinion’s Mark Gongloff.",3,cna_world
"Commentary: Could Trump save TikTok from US ban, as he promised?","The United States may have passed a law to ban TikTok unless Chinese owner ByteDance sells it, but incoming president Donald Trump has promised to “save” the app. NTU’s Mark Cenite considers the possible scenarios.",3,cna_world
"Europeans will ramp up support for Ukraine's defence industry, says German minister",,2,cna_world
Egypt says over a dozen missing after Red Sea tourist boat capsizes,,3,cna_world
Israel to decide on ceasefire as US says deal 'close',,2,cna_world
Special counsel asks judge to dismiss subversion case against Trump,,1,cna_world
G7 ministers discuss ceasefire efforts in Mideast,,1,cna_world
Israel far-right minister says Lebanon ceasefire now 'big mistake',,2,cna_world
New cash for job centres in plan to boost workforce,The government reveals a £240m investment plan to increase the number of people working in Britain.,1,bbc
Russian deserter reveals war secrets of guarding nuclear base,"A combat alert was in place on the day Russia invaded Ukraine, he tells the BBC.",1,bbc
More rain forecast after Storm Bert hits UK,"At least five people died as the storm brought heavy rain, wind and snow over the weekend.",2,bbc
"Trump threatens China, Mexico and Canada with new tariffs",The president-elect said he plans to impose 25% tariffs on Mexico and Canada and an additional 10% on China on his first day in office.,3,bbc
Gangsters block aid distribution in south Gaza,"Aid workers say armed gangs operating within sight of Israeli forces are looting supplies, amid severe shortages.",2,bbc
Reeves tells firms no more tax rises as she defends Budget,"Chancellor Rachel Reeves tells the CBI conference she is ""not coming back with more borrowing or more taxes"".",1,bbc
Prosecutors demand 20-year jail sentence for husband in mass rape trial,"Dominique Pelicot, 72, is facing the maximum sentence for rape in a case that has horrified France.",1,bbc
"Israel and Lebanon close to ceasefire deal, Israeli officials say","Israel's cabinet will meet on Tuesday to discuss a possible deal, as the US cautions, ""we're not done yet"".",3,bbc
"We were ready to leave climate summit, negotiator tells BBC",A key negotiator with the group that pushed climate talks close to collapse speaks to the BBC about what happened.,1,bbc
Supreme Court to hear case on definition of a woman,Judges will consider a legal challenge which could affect how women and trans people are treated.,1,bbc
"The Papers:  'No more tax rises, insists Reeves' and 'PM in jobs push'","The Chancellor ruling out more tax rises and the PM's pledge to ""overhaul"" job centres leads the papers.",1,bbc
Barbara Taylor Bradford: An author of substance,"The life of the prolific writer, famous for family sagas with female characters as strong as herself.",1,bbc
First Lady receives White House Christmas tree,"Jill Biden, accompanied by her grandson Beau, welcomed the arrival of the festive fir hailing from North Carolina.",1,bbc
Emergency crews tackle flood waters in rescue operations,"More than 100 flood warnings are in places across the country, with homes, businesses and roads being impacted.",1,bbc
Elton John album on hold because he 'can't see',"He says he ""can't see anything, I can't read anything, I can't watch anything"" after an eye infection.",1,bbc
"Reeves My Lips, No New Taxes (On Business)",Chancellor tells businesses she is “not coming back with more borrowing or more taxes”.,1,bbc
Bethell to bat at three on England Test debut,Jacob Bethell will bat at number three on his Test debut in England's series opener against New Zealand in Christchurch on Thursday.,1,bbc
Root 'a rung below' Smith and Kohli - Lehmann,"England batter Joe Root needs to score a century in Australia to be considered an all-time great, says Darren Lehmann.",1,bbc
General Motors agrees deal to enter F1 in 2026,US car giant General Motors reaches an agreement in principle to enter Formula 1 in 2026 with its Cadillac brand.,1,bbc
'A huge result' - could West Ham win at Newcastle be turning point for Lopetegui?,Could West Ham's win and 'huge result' at Newcastle be the turning point for manager Julen Lopetegui's reign?,1,bbc
'As open as it has ever been' - is this the tightest Premier League?,"Liverpool are eight points clear at the top, but below them just one point separates second to fifth in what appears an open race to finish in the European spots.",1,bbc
Salah selfish for contract comments - Carragher,"Mohamed Salah is ""selfish"" for publicly expressing his disappointment at Liverpool's failure to offer him a new contract, says former Reds defender Jamie Carragher.",1,bbc
Who has made Troy's Premier League team of the week?,"After every round of Premier League matches this season, Troy Deeney gives us his team of the week. Do you agree with his choices?",1,bbc
Man admits murdering 'defenceless' woman in front of friends,"Logan Burnett is remanded in custody ahead of his sentencing on 17 February, a court hears.",2,bbc
Parents question 'flawed' Garda canal death probe,Kelly Lynch's parents say they still have unanswered questions about her death  eight months ago.,1,bbc
Rugby club devastated by Storm Bert had no insurance,"The club failed to find insurance cover after it was flooded in 2020, and has been hit again.",2,bbc
Blackpink's Rose says K-pop stars are under pressure to always be 'perfect',"The singer admitted that she found her first few years in K-pop ""very difficult"" because she had to learn how to present her “perfect” persona in the girl group.",1,cna_latest
Toney promises to give his all for Al-Ahli after Asian Champions League double,,1,cna_latest
Google proposes fresh tweaks to search results in Europe,,1,cna_latest
China's Huawei to launch 'milestone' smartphone with homegrown OS,,2,cna_latest
China’s cash-strapped shoppers drawn to second-hand luxury items,Price-conscious buyers hunt for deals while others seek goods that can hold value in times of uncertainty.,1,cna_latest
Stick or twist? Australia digests Perth mauling,,1,cna_latest
Two people charged with false trading in shares of luxury car distributor,,2,cna_latest
Jail for chef who charged at colleague with knife over work-related stress,"The chef felt that the victim was giving him tasks outside of his job scope, but that did not justify his offence, the prosecutor said.",2,cna_latest
Companies that might be affected by Trump's promised tariffs,,1,cna_latest
Fitch puts some Adani bonds on negative watch after US bribery charges,,2,cna_latest
"Kohli doesn't need us, we need him, says India's Bumrah",,1,cna_latest
