title,description,impact,source
"PAP elects top decision-making body, Chee Hong Tat joins CEC for first time","The latest central executive committee will lead the ruling People's Action Party into the next general election, which must be held by November next year.",2,cna_latest
"With high stakes in next general election, PAP can no longer 'afford to stay in the background': Lawrence Wong","The People's Action Party must come out to explain policies and mobilise citizens, says the party's deputy secretary-general and prime minister of Singapore.",1,cna_latest
Orderly transitions in political leadership cannot be taken for granted: SM Lee in last speech as PAP chief,"Prime Minister Lawrence Wong taking over as the People's Action Party's secretary-general will complete Singapore's latest smooth leadership transition, says Lee Hsien Loong.",2,cna_latest
Wanderers coach Stajcic brands Mata agent 'cowardly' after criticism,,2,cna_latest
Quesada frustrated by Italy defeat to All Blacks but sees improvement,,2,cna_latest
Jordan happy with All Blacks arm wrestle win over Italy,,1,cna_latest
Flick says Barcelona played bad and were lucky to draw at Celta Vigo,,1,cna_latest
Actress Cynthia Erivo wore her fitness watch underneath her Wicked costume,Cynthia Erivo was determined to keep up her daily step count on the set of Wicked and hid her fitness watch underneath her witch outfit.,1,cna_latest
"Secrets for healthy flying from doctors who treat pilots: Before booking a flight, at the airport, while in the air",Heres what specialists in aerospace medicine want you to know about air travel.,1,cna_latest
Can Korean hip-hop become as big as K-pop? How a music label founded by Jay Park signed GOT7s Yugyeom,"CNA Lifestyle recently spoke withYoo Deok-gon, the CEO of the popular South Korean hip-hop label AOMG, to get his thoughts on the rise of Korean hip-hop and its close ties with K-pop.",1,cna_latest
Man United's Amorim says he can be ruthless when required,,1,cna_latest
"What is Hon-Gyokuro, one of the rarest types of Japanese green tea in the world?","CNA Luxury attends a Hon-Gyokuro tea appreciation session with TWG Tea, where we learn about its meticulous harvesting process and various infusion methods that bring out its distinct flavours.",2,cna_latest
Celta fight back to hold 10-man Barca to 2-2 draw,,2,cna_latest
I have two mothers: Reunion with former helper prompts wave of emotion online,"On The Red Dots latest series features young Singaporeans reconnecting with their long-time helpers, and it has triggered an outpouring of sentiment as netizens pay tribute to the domestic workers who helped raise them.",1,cna_singapore
"Peregrine falcons recorded nesting in Singapore's CBD for first time, tray set up to encourage breeding","A pair of peregrine falcons was recorded nesting in a recess high up on OCBC Centre at Chulia Street in 2024. While unsuccessful, some changes are in place ahead of their breeding season in 2025.",2,cna_singapore
Christmas tree on Design Orchard mall rooftop catches fire,,2,cna_singapore
Lee Hsien Loong to step down as PAP secretary-general after 20 years at the helm,Members of the ruling People's Action Party paid tribute to Senior Minister Lee as part of its 70th anniversary celebrations.,3,cna_singapore
CNA wins Best News Explainer at AIB Awards in London for video on Israel-Gaza war,CNA also won in the investigative documentary category for a programme on toxic medicine that killed hundreds of children worldwide.,1,cna_singapore
This surgeon is saving womens lives and the earth: We can't be healthy if the world we live in is not healthy,"From re-using old operating theatre clogs to upcycling clean instrument set wrappers used in surgeries and cutting out cutlery packaging in patients meals, Associate Professor Benita Tan has been leading Sengkang General Hospitals sustainability efforts since 2012. She tells CNA Women how all can play a part in saving the planet.",1,cna_singapore
"Fugitive Singapore lawyer Charles Yeo granted bail by UK court, put on curfew before extradition hearing","Singapore has requested the extradition of Charles Yeo, who is wanted on several charges.",2,cna_singapore
A Letter to Myself Podcast: A mothers battle to overcome drug addiction fuelled by the fear of losing her children,"While serving time, Syamlia overheard someone saying they sold drugs to primary school kids. Shocked and worried, she thought about her three young children and decided she needed to get clean.",1,cna_singapore
New ambulance traffic priority system for life-threatening cases activated 76 times in three months,"It reduced the time taken to send the patients toNg Teng Fong General Hospitalby an average of 1 minute and 40 seconds,according to data collected over three months.",1,cna_singapore
Healthcare costs are rising in Singapore. Is there really nothing we can do about it?,"Healthcare spending is growing, along with government subsidies owing to an ageing population, medical advances and increased operational costs. Here are some measures being taken to help people cope and how the public can play a part.",1,cna_singapore
Singapore recalls French cheese product after potential contamination with gastroenteritis-causing bacteria,,3,cna_singapore
"Flash floods hit Yishun, Potong Pasir as northern Singapore records one of highest daily rainfalls since 1978",,2,cna_singapore
Court of Appeal of Singapore rules that Parmesan and Parmigiano Reggiano are not the same cheese,"To Singapore consumers, Parmesan is a type of cheese that can come from outside Italy, the judges found in a dispute on geographical indications.",1,cna_singapore
What is Singapore doing to protect people from floods?,"Over the past decade, the government has invested S$2 billion to improve the country's drainage infrastructure.",2,cna_singapore
"BigBang's Taeyang joins Yuewen Music Festival 2024 in Singapore, will perform on same day as Daesung","TheEyes, Nose, Lips singer will be performing at Sentosa's Siloso Beach on Sunday (Dec 29) the same day as his BigBang groupmate Daesung.",2,cna_singapore
"Ex-DBS employee jailed for accessing customer data, passing details to moneylender and bookie","Huang Pin Wen committed his offences, which numbered more than 120, out of ""foolishness"" and to impress others, his lawyer said.",2,cna_singapore
'The world is crazy': Spate of mass casualty incidents in China reveal pent up grievances and anger,"Three public attacks in China's Changde, Zhuhai and Yixing cities that killed dozens, have raised alarm among many, as well as questions about underlying issues facing society.",3,cna_asia
Families fleeing after 32 killed in new sectarian violence in Pakistan,,3,cna_asia
Sri Lanka's new leader sticks within IMF 'guardrails',,1,cna_asia
Philippine VP says she would have Marcos assassinated if she is killed,,2,cna_asia
Cambodia's flagship canal in hot water as China funding dries up,,2,cna_asia
Laos government 'profoundly saddened' by tourist deaths from suspected methanol poisoning,,1,cna_asia
D for slow reforms but A for staying power? Critics grade Malaysian PM Anwars 2-year-old government,"Some experts have called for greater urgency over the pace of reform, while others praised Prime Minister Anwar Ibrahims commitment and staying power.",1,cna_asia
Commentary: US bribery case against Indian tycoon Adani is bad news for Modi,"The indictment will intensify political attacks on India Prime Minister Narendra Modi for his proximity to billionaire Gautam Adani, says Bloomberg Opinions Andy Mukherjee.",1,cna_asia
India aims to stamp out farm fires with satellite images of scorched earth,,2,cna_asia
India court tells smog-hit capital to step up vehicle restrictions,,1,cna_asia
Debate in Malaysia over PM Anwars revelation that private firms partly funded his recent overseas trips,A minister later clarified that the corporate executives who went along paid their own way while the government covered the costs for Prime Minister Anwar Ibrahims delegation.,1,cna_asia
Western leaders on their guard with China ahead of Trump return,,2,cna_asia
What you need to know about Adani's US bribery indictment,,3,cna_asia
"Russia gave North Korea oil, anti-air missiles in exchange for troops: Officials",,2,cna_asia
"Taiwan's president to visit Pacific allies, no details on US transits",,2,cna_asia
South Korea's mountain of plastic waste shows limits of recycling,,2,cna_asia
CNA Explains: What is methanol poisoning and how can you avoid it while travelling?,Sixtourists who were travelling in Laos have died from suspected methanol poisoning.,2,cna_asia
"Jakarta governor race heats up as Jokowi, ex-presidential hopeful Anies throw weight behind different candidates",Jakarta is a key battleground in Indonesias Nov 27 regional elections. Former president Joko Widodo is backing Mr Ridwan Kamil while former Jakarta governor Anies Baswedan is supporting PDI-Ps Pramono Anung.,2,cna_asia
Inside the South Korean weapons factory that could supply Kyiv,,2,cna_asia
Indian tycoon Adani's US indictment spooks investors; bonds fall again,,1,cna_asia
Developing nations blast US$300 billion COP29 climate deal as insufficient,,3,cna_world
Thousands protest in Valencia over lack of schools after deadly floods,,3,cna_world
Hamas armed wing says Israeli woman hostage killed in north Gaza,,3,cna_world
US says committed to 'diplomatic resolution' in Lebanon,,1,cna_world
"Ukraine has lost over 40% of Russia's Kursk region to counter-attacks, senior Kyiv military source says",,3,cna_world
EU raises cash offer to poor nations in deadlocked climate talks,,2,cna_world
NATO chief discusses 'global security' with Trump,,2,cna_world
Nvidia will balance compliance and tech advances under Trump: CEO,,2,cna_world
US reports first bird flu case in a child,,3,cna_world
Trump names hedge fund manager Scott Bessent as Treasury chief,,1,cna_world
"Commentary: Putin escalates Ukraine war by a step, not a leap, with missile experiment","The strike, with what President Vladimir Putin called a new ballistic missile, appears to be an elaborately staged attempt to show Russia will outbid the West over Ukraine, says the Financial Times Ben Hall.",1,cna_world
COP29 in extra time as poor nations reject US$250 billion offer,,3,cna_world
Judge in Trump criminal case delays sentencing indefinitely,,2,cna_world
Little hope in Gaza that arrest warrants will cool Israeli onslaught,,2,cna_world
Putin says Russia will keep testing new missile in combat,,2,cna_world
Ukraine parliament cancels session over threat of Russian attack,,2,cna_world
"Israeli strikes batter Lebanon, killing five medics",,3,cna_world
"Blinken to attend G7 meeting in Italy, US State Department says",,1,cna_world
Landmark $300bn for poorer nations in COP29 climate deal,A deal is salvaged at the UN summit as poorer nations are promised record funding for climate action.,3,bbc
"No 'red lines' in Ukraine support, French foreign minister tells BBC",Jean-Nol Barrot speaks to Laura Kuenssberg after a week of escalation in Ukraine.,1,bbc
Man dies after tree falls on car as Storm Bert sweeps UK,"Weather warnings for rain, wind, and floods remain in place for much of England, Scotland, and Wales.",2,bbc
'Refused service yet again with my guide dog - I'm done speaking out',Sean Dilley is inundated with abuse on social media whenever he posts about discrimination issues.,1,bbc
'I was scammed out of 75k by Martin Lewis deepfake advert',"Des Healey lost 76,000 in a scam using a deepfake of Martin Lewis and Elon Musk.",2,bbc
"In stifled sobs and fierce accusations, family falls apart at mass rape trial","Gisle Pelicot, 71, is the woman at the centre of this trial, but no-one has emerged unscathed in her family.",2,bbc
Mystery drones seen over three US air bases in UK,"The United States Air Force says it is unclear if the ""small unmanned aerial systems"" were hostile.",2,bbc
'We knew Christmas before you' - the Band Aid fallout,"Forty years on, the Band Aid song continues to generate debate about the way it presents Africa.",1,bbc
Perfume boss captured on video admitting he ignored Russia sanctions,"David Crisp told undercover agent he had ignored ""government edicts"" to sell 1.7m of his luxury product.",1,bbc
UK wants to hire EU negotiator to 'reset' relations,"The role will prepare and lead negotiations with the EU on key UK interests, the job posting said.",1,bbc
'Love you bro' - Zayn Malik's tribute to Payne at gig,The singer began his tour in Leeds following his former One Direction bandmate Liam Payne's death.,1,bbc
Nominee for agriculture secretary completes Trump cabinet,Brooke Rollins - head of a pro-Trump right-wing think tank - is his pick for agriculture secretary.,1,bbc
"'Trust and reserve judgement' on rebrand, says Jaguar after backlash","The iconic carmaker's rebrand has certainly caught people's attention, but will it pay off?",1,bbc
The Papers: 'Two thirds back assisted dying' and 'Putin ready to cripple Britain',The upcoming vote on legalising assisted dying and the rising threat of Russia leads several papers.,1,bbc
'Don't forget us': Teenage refugee reminds Gen Z of silenced Afghan girls,Nila Ibrahimi won the International Children's Peace Prize for her work giving Afghan girls a voice.,2,bbc
India's 'rebel' Muslim princess who shot tigers and drove a Rolls-Royce,Abida Sultaan defied stereotypes around women in general and Muslim women in particular.,1,bbc
"Russia ready to wage cyber war on UK, minister to say",Pat McFadden will tell a Nato conference that Russia could try to attack British businesses and power grids.,2,bbc
"'I don't like crisps, but I collect the packets'",Frank Munford's collection ranges from 1970s packets of Tudor Crisps to a Walkers tracksuit top.,1,bbc
China's huge sinkholes reveal hidden treasures as viral videos draw tourists,"These caves were unexplored for thousands of years, protected by swirling mists and terrifying tales.",2,bbc
BBC News app,"Top stories, breaking news, live reporting, and follow news topics that match your interests",1,bbc
Your pictures of Storm Bert from around the UK,There's widespread disruption across the country as severe weather hits large areas.,1,bbc
Israel investigating disappearance of rabbi in UAE,"Rabbi Zvi Kogan has been missing since Thursday, the Israeli prime minister's office said.",3,bbc
Israel investigates as Hamas says female hostage killed,The woman's identity has not been revealed and it is unclear how or when she is said to have died.,2,bbc
'Are we not humans?': Anger in Beirut as massive Israeli strike kills 20,The death toll from the strike on a multi-storey building in central Beirut's Basta district is expected to rise.,3,bbc
Murray to coach Djokovic at Australian Open,Andy Murray will coach his long-time former rival Novak Djokovic at the Australian Open in 2025.,1,bbc
Will Rachel Reeves' difficult week cause her lasting damage?,BBC's Ben Wright looks at the impact of a tricky week of scrutiny for the chancellor.,1,bbc
How serious are Putin's nuclear threats?,Three Ukrainians on how their lives have changed and their hopes for peace,2,bbc
The Assisted Dying Debate: Ex-PM Gordon Brown Intervenes,"And, could French missiles also now be fired into Russian territory?",2,bbc
'In eight years we never lived like this' - what is wrong at Man City?,"After Man City's 4-0 humbling to Tottenham made it five defeats in a row, BBC Sport looks at what is going wrong for the Premier League champions.",1,bbc
Wales coach Gatland to learn fate in coming days,Warren Gatland's future as Wales head coach will be part of a review into the Autumn Nations Series by the Welsh Rugby Union.,1,bbc
Why 'extra special' Nwaneri has to remain patient,"Ethan Nwaneri is the second-youngest player to score a Premier League goal for Arsenal, behind only Cesc Fabregas - but Mikel Arteta explains why he must stay patient.",1,bbc
"'Time for Scotland to deliver result, not moments'","Scotland have long been capable of flashes of brilliance, but now they need a winning performance when Australia visit, writes Tom English.",1,bbc
Kane scores hat-trick to break Bundesliga record,Watch highlights as Harry Kane scores a hat-trick for Bayern Munich during their 3-0 win over Augsburg to become the fastest player to reach 50 goals in the Bundesliga.,1,bbc
Murder arrest after man shot dead in Birmingham,Police say a man in his 20s was found in a car and pronounced dead at the scene.,2,bbc
Homes flooded and travel disrupted by Storm Bert,"Heavy wind and rain brings flooding to Dundonald and Coalisland, as well as widespread travel disruption.",3,bbc
Flood fears as Storm Bert heads into second day,Scotland is bracing for a second day of disruption with high winds and localised flooding forecast.,3,bbc
Storm Bert brings landslide and 82mph gusts,"Ten people were rescued after a landslide near Llangollen, Denbighshire, on Saturday afternoon.",3,bbc
India maintain dominant position over Australia,India's openers ensure they maintain their dominant position against Australia with an unbroken century stand on day two of the first Test in Perth.,1,
Blackburn v Portsmouth among games hit by Storm Bert,"Storm Bert affects Saturday's fixture lists in the EFL and National League, with several postponements following pitch inspections.",2,
Multi-hazard' Storm Bert causing disruption across UK,"High winds and snow are affecting road and rail travel, while heavy rain brings the potential for flooding.",3,manual
"Bitcoin smashes record-high, lifting value of crypto market past pandemic-era peak",,3,manual
"Death toll from South Korea Halloween crush rises to 153, including 22 foreigners",,3,manual
Malaysia Airlines loses contact with plane carrying 239 people,,3,manual
Hamas confirms leader Yahya Sinwar killed in combat in Gaza by Israeli army,,3,manual
Donald Trump wins 2024 US election in historic comeback,,3,manual
"Car crashes into crowd in China's Zhuhai, killing 35 and wounding 43",,3,manual
Wagner chief Yevgeny Prigozhin presumed dead after Russia plane crash,"Russian mercenary leader Yevgeny Prigozhin was on the passenger list of a jet which crashed in Russia killing all 10 people on board, Russia's civil aviation authority says.",3,manual
$3b money laundering case: $1.85b in assets surrendered by 15 suspects on the run,"The total amount of assets surrendered in the case is almost $2.8 billion so far, with $944 million in assets previously surrendered.",3,manual
K-drama actor Song Jae-rim dies at 39,"Song, who acted in blockbuster dramas including The Moon Embracing The Sun, was found dead at his home in Seoul.",2,manual
"Liam Payne, 31, Former One Direction Singer, Dies in Fall in Argentina",,3,manual
Stolen shoe mystery solved at Japanese kindergarten when security camera catches weasel in the act,,2,cna_latest
Rallying-Neuville secures his first world championship in Japan,,2,cna_latest
Scientists seek miracle pill to stop methane cow burps,,3,cna_latest
Verstappen takes his fourth F1 title in Las Vegas,,3,cna_latest
SM Lee Hsien Loong to visit China from Nov 24; set to meet President Xi Jinping,This is Mr Lee’s first visit to China since stepping down as Singapore prime minister in May and handing the leadership reins to Mr Lawrence Wong.,2,cna_latest
Erasmus satisfied with Springboks year as player pool grows,,1,cna_latest
Smylie holds off major winner Smith to claim Australian PGA title,,1,cna_latest
Fire rips through slum area in Philippine capital,,3,cna_latest
"PAP must adapt to evolving societal needs, while Singapore navigates 'far more dangerous world': PM Wong","Singapore will find it more difficult to make a living and keep itself safe with more global conflict and instability expected in the next decade, says the prime minister.",1,cna_latest
Singaporean director Chiang Wei Liang wins best new director at Golden Horse Awards 2024,Chiang's film Mongrel had received seven nominations.,1,cna_latest
Jaiswal lifts India to 275-1 at lunch on day three,,1,cna_latest
Storm Bert: Flood warnings in place after man dies,"Flood warnings and alerts are in place across the UK, as disruption from the storm continues.",3,bbc
"Body of missing rabbi found in UAE, Israel says","The Israeli-Moldovan national went missing on Thursday, sparking a Mossad investigation.",2,bbc
Can RFK Jr make America's diet healthy again?,Kennedy's plans to ban dyes in cereals and fluoride in water could get major pushback from the food industry.,1,bbc
'I'm the UK's number one Trump impersonator',Donald Trump impressionist Mike Osman is inspired to keep performing after the US election.,1,bbc
Verstappen wins title as Russell triumphs in Vegas,Red Bull’s Max Verstappen wins his fourth consecutive World Drivers’ Championship as George Russell takes race victory in the Las Vegas Grand Prix.,2,bbc
What being coached by Murray could do for Djokovic,BBC tennis correspondent Russell Fuller assesses what Novak Djokovic's shock appointment of Andy Murray as coach could mean for both men.,1,bbc
England's Cox out of New Zealand series with broken thumb,Wicketkeeper Jordan Cox is ruled out of England's series in New Zealand after suffering a broken thumb.,1,bbc
"'The second Special One' - Amorim, by those who know him best","From rejection at Benfica to new Manchester United boss, BBC Sport charts the rise of Ruben Amorim.",1,bbc
Shearer on his 'concerns' for Man City,"Match of the Day's Alan Shearer says Manchester City are showing ""worrying signs"" after losing 4-0 to Tottenham at home, their fifth loss in a row.",1,bbc
MPs back calls for pub bombings inquiry,"Sarah Edwards and Dr Neil Shastri-Hurst both say the victims and their families deserve ""closure"".",2,bbc
Northern Ireland is being left behind on assisted dying',"There are moves to bring assisted dying into law in England, Wales, Scotland and Ireland.",3,bbc
Flood warnings across Wales with more rain to come,More than 100 flood warnings and alerts issued with a new weather warning in place for more rain.,2,bbc
"US SEC issues summons for India's Adani, nephew on bribery allegations",,2,cna_latest
"Onus on PAP to resonate with voters and rally them to a cause, amid shifting political landscape: Analysts","With elections round the corner, the People's Action Party must also show how one-party dominance is still relevant today, according to an observer speaking after Singapore all but completed its leadership transition.",1,cna_latest
Verstappen wins fourth consecutive Formula 1 world title,,3,cna_latest
"Centurions Jaiswal, Kohli wear down Australia as India eye big win",,1,cna_latest
Your pictures on the theme of 'autumn walks',Photographs on the theme of 'autumn walks' sent in by our readers.,1,bbc
'I can't say what my face will do in two hours',"Amy Green, who has Bell's palsy, says seeing Tulisa on TV helps raise awareness of the condition.",1,bbc
Irish justice minister praises 'bravery' of woman in Conor McGregor rape case,"Justice Minister Helen McEntee said Nikita Hand had shown ""there is light at the end of the tunnel"".",2,bbc
Marta and Orlando Pride win first NWSL title,Brazil legend Marta celebrates the first NWSL championship of her glittering career after the Orlando Pride beat the Washington Spirit 1-0 on Saturday.,1,bbc
Homes and roads flooded as Storm Bert batters Wales,Homes and roads have been flooded as Storm Bert continues to batter the UK.,2,bbc
"Verstappen hails most impressive season, if not the best",,1,cna_latest
Australia forced into late change for Scotland clash,,1,cna_latest
Ukraine studies debris from new Russian ballistic missile,,1,cna_latest
Pant and Iyer shatter IPL pay record with eye-watering deals,,1,cna_latest
F1 drivers praise growth of Las Vegas Grand Prix,,1,cna_latest
Robertson renews call for change to All Blacks overseas-based players ban,,1,cna_latest
"Russia removes commander in Ukraine for misleading reports, war bloggers say",,3,cna_latest
'Nobody is unbeatable': Verstappen rivals believe they can dethrone the champ,,1,cna_latest
"Ukraine needs better air defences, Zelenskyy says after Russian drone attack",,2,cna_latest
Israel says rabbi killed in UAE in 'anti-Semitic' attack,,3,cna_latest
"Young people who refuse to work to lose benefits, says minister","Liz Kendall says young people will have a responsibility to take up new opportunities for ""earning or learning"".",2,bbc
"Assisted dying bill about right to choose, says minister",Labour’s cabinet remains divided on how to vote on Friday’s bill to legalise assisted dying.,1,bbc
South Korean man dodged draft by binge eating,"The 26-year-old man began deliberately gaining weight before a physical examination, a judge ruled.",2,bbc
Burning old TVs to survive: The toxic trade in electrical waste,People around the world are extracting valuable materials from e-waste despite huge health risks.,1,bbc
Dozens killed in Pakistan sectarian violence,More than 80 die in a tribal area of Pakistan riven by tensions between Shia and Sunni communities.,3,bbc
Man arrested over fatal shooting in Birmingham released,Police say a man who was arrested on suspicion of murder has been released without charge.,2,bbc
Champion Verstappen 'hungry' for more title success in 2025,"Max Verstappen says his fourth world title came after a ""very challenging"" season and he is ""hungry"" to bid for more success in 2025.",1,bbc
Pant becomes most expensive player in IPL history,Rishabh Pant becomes the most expensive player in the history of the Indian Premier League as he joins Lucknow Super Giants for 27 crore (£2.54m).,2,bbc
Man critical after stabbing on Westminster Bridge,A man is in a critical condition after being stabbed on Westminster Bridge on Sunday morning.,2,bbc
Fresh Storm Bert wind warning comes into force,A yellow wind warning comes into effect across Northern Ireland until 18:00 GMT on Sunday.,2,bbc
